{
  "app": {
    "calib_algorithm": "p14-calib-v1",
    "geometry_version": "p04-geometry-v1",
    "git_dirty": true,
    "git_sha": "0000000000000000000000000000000000000000",
    "version": "0.14.0"
  },
  "calibration_id": "example-synthetic-selftest",
  "camera": {
    "check": {
      "delivered_fps_median": 30.000000000001705,
      "dropped_total": 0,
      "exposure_advice": "OK",
      "fps_relative_error": 5.684341886080802e-14,
      "frames": 91,
      "interval_p95_s": 0.03333333333334565,
      "label": "delivered-rate spot check from software t_capture stamps; NOT a native-FPS measurement (Task 02.4) and never written to camera_profile.native_fps_measured",
      "mismatches": [],
      "roi_mean_gray": 120.0,
      "status": "PASSED",
      "warnings": [],
      "window_s": 3.0
    },
    "exposure": {
      "mode": "MANUAL",
      "value": -6
    },
    "profile_hash": "sha256:8ebf4fa92481f2f28262c709788b0a47c3ab2764e6cde0d5a02fc788e9fa47f1",
    "profile_id": "hw01-integrated-webcam-v0",
    "requested_fps": 30,
    "resolution_px": [
      640,
      480
    ]
  },
  "created_at": "2026-09-26T10:00:00+03:00",
  "durations_s": {
    "camera_check": 5.0,
    "clock": "synthetic",
    "playing_area": 7.033333333333331,
    "resumed": false,
    "save": 0.06666666666666288,
    "stick_prior": 5.033333333333331,
    "total": 60.19999999999999,
    "validation": 33.03333333333333,
    "zone_placement": 10.033333333333331
  },
  "layout": {
    "attempts": 1,
    "checks": {
      "inside_roi": {
        "inset": 0.0,
        "outside": [],
        "passed": true
      },
      "overlap": {
        "ambiguity_gap": 0.01,
        "method": "circumscribed 64-gon outlines; edge crossing/containment test",
        "near_pairs": [],
        "overlapping_pairs": [],
        "passed": true
      }
    },
    "fit": {
      "clamped": false,
      "fitted_bbox": [
        0.13325469462240125,
        0.2891794816214951,
        0.8670696197172617,
        0.7491882788312666
      ],
      "mode": "ENVELOPE",
      "scale": 0.825401609647918,
      "settings": {
        "margin": 0.02,
        "roi_inset": 0.01,
        "scale_max": 1.3,
        "scale_min": 0.7
      },
      "target_box": [
        0.13325469462240122,
        0.2627014907649305,
        0.8670696197172617,
        0.7756662696878311
      ],
      "template_bbox": [
        0.07,
        0.22268487990229135,
        0.9590398522579516,
        0.78
      ],
      "translate": [
        0.07547658194704698,
        0.10537502330589055
      ],
      "warnings": []
    },
    "max_nudge": 0.05,
    "nudges": {},
    "sample_overrides": {},
    "template": {
      "layout_id": "mvp4",
      "source": "configs/zones/mvp4.candidate.yaml",
      "zones": [
        {
          "gain_curve_id": "default",
          "impact_surface": {
            "angle_rad": 0.0,
            "center": [
              0.2,
              0.32
            ],
            "rx": 0.13,
            "ry": 0.07,
            "theta_end_rad": 6.283185307179586,
            "theta_start_rad": 3.141592653589793,
            "type": "ARC"
          },
          "inward_normal": [
            0.0,
            1.0
          ],
          "name": "Hi-Hat",
          "sample_id": "tr505-hihat-closed",
          "shape": {
            "angle_rad": 0.0,
            "center": [
              0.2,
              0.32
            ],
            "rx": 0.13,
            "ry": 0.07,
            "type": "ELLIPSE"
          },
          "trigger_type": "HAND_TIP",
          "zone_id": "hihat"
        },
        {
          "gain_curve_id": "default",
          "impact_surface": {
            "angle_rad": 0.0,
            "center": [
              0.4,
              0.68
            ],
            "rx": 0.16,
            "ry": 0.1,
            "theta_end_rad": 6.283185307179586,
            "theta_start_rad": 3.141592653589793,
            "type": "ARC"
          },
          "inward_normal": [
            0.0,
            1.0
          ],
          "name": "Snare",
          "sample_id": "tr505-snare",
          "shape": {
            "angle_rad": 0.0,
            "center": [
              0.4,
              0.68
            ],
            "rx": 0.16,
            "ry": 0.1,
            "type": "ELLIPSE"
          },
          "trigger_type": "HAND_TIP",
          "zone_id": "snare"
        },
        {
          "gain_curve_id": "default",
          "impact_surface": {
            "angle_rad": 0.0,
            "center": [
              0.5,
              0.38
            ],
            "rx": 0.13,
            "ry": 0.08,
            "theta_end_rad": 6.283185307179586,
            "theta_start_rad": 3.141592653589793,
            "type": "ARC"
          },
          "inward_normal": [
            0.0,
            1.0
          ],
          "name": "Tom 1",
          "sample_id": "tr505-tom-h",
          "shape": {
            "angle_rad": 0.0,
            "center": [
              0.5,
              0.38
            ],
            "rx": 0.13,
            "ry": 0.08,
            "type": "ELLIPSE"
          },
          "trigger_type": "HAND_TIP",
          "zone_id": "tom1"
        },
        {
          "gain_curve_id": "default",
          "impact_surface": {
            "angle_rad": 0.12,
            "center": [
              0.8,
              0.29
            ],
            "rx": 0.16,
            "ry": 0.065,
            "theta_end_rad": 6.283185307179586,
            "theta_start_rad": 3.141592653589793,
            "type": "ARC"
          },
          "inward_normal": [
            -0.1197122073,
            0.9928086359
          ],
          "name": "Crash/Ride",
          "sample_id": "tr505-crash",
          "shape": {
            "angle_rad": 0.12,
            "center": [
              0.8,
              0.29
            ],
            "rx": 0.16,
            "ry": 0.065,
            "type": "ELLIPSE"
          },
          "trigger_type": "HAND_TIP",
          "zone_id": "crash_ride"
        }
      ],
      "zones_hash": "sha256:856a9a031964e4a3f386dbdf169a3960da58948cd122b2859ea6776bb0584dfe"
    },
    "zones": [
      {
        "gain_curve_id": "default",
        "impact_surface": {
          "angle_rad": 0.0,
          "center": [
            0.2405569038766306,
            0.3695035383932243
          ],
          "rx": 0.10730220925422934,
          "ry": 0.057778112675354265,
          "theta_end_rad": 6.283185307179586,
          "theta_start_rad": 3.141592653589793,
          "type": "ARC"
        },
        "inward_normal": [
          0.0,
          1.0
        ],
        "name": "Hi-Hat",
        "sample_id": "tr505-hihat-closed",
        "shape": {
          "angle_rad": 0.0,
          "center": [
            0.2405569038766306,
            0.3695035383932243
          ],
          "rx": 0.10730220925422934,
          "ry": 0.057778112675354265,
          "type": "ELLIPSE"
        },
        "trigger_type": "HAND_TIP",
        "zone_id": "hihat"
      },
      {
        "gain_curve_id": "default",
        "impact_surface": {
          "angle_rad": 0.0,
          "center": [
            0.4056372258062142,
            0.6666481178664748
          ],
          "rx": 0.13206425754366688,
          "ry": 0.0825401609647918,
          "theta_end_rad": 6.283185307179586,
          "theta_start_rad": 3.141592653589793,
          "type": "ARC"
        },
        "inward_normal": [
          0.0,
          1.0
        ],
        "name": "Snare",
        "sample_id": "tr505-snare",
        "shape": {
          "angle_rad": 0.0,
          "center": [
            0.4056372258062142,
            0.6666481178664748
          ],
          "rx": 0.13206425754366688,
          "ry": 0.0825401609647918,
          "type": "ELLIPSE"
        },
        "trigger_type": "HAND_TIP",
        "zone_id": "snare"
      },
      {
        "gain_curve_id": "default",
        "impact_surface": {
          "angle_rad": 0.0,
          "center": [
            0.48817738677100597,
            0.4190276349720994
          ],
          "rx": 0.10730220925422934,
          "ry": 0.06603212877183344,
          "theta_end_rad": 6.283185307179586,
          "theta_start_rad": 3.141592653589793,
          "type": "ARC"
        },
        "inward_normal": [
          0.0,
          1.0
        ],
        "name": "Tom 1",
        "sample_id": "tr505-tom-h",
        "shape": {
          "angle_rad": 0.0,
          "center": [
            0.48817738677100597,
            0.4190276349720994
          ],
          "rx": 0.10730220925422934,
          "ry": 0.06603212877183344,
          "type": "ELLIPSE"
        },
        "trigger_type": "HAND_TIP",
        "zone_id": "tom1"
      },
      {
        "gain_curve_id": "default",
        "impact_surface": {
          "angle_rad": 0.12,
          "center": [
            0.7357978696653814,
            0.34474149010378674
          ],
          "rx": 0.13206425754366688,
          "ry": 0.05365110462711467,
          "theta_end_rad": 6.283185307179586,
          "theta_start_rad": 3.141592653589793,
          "type": "ARC"
        },
        "inward_normal": [
          -0.1197122073,
          0.9928086359
        ],
        "name": "Crash/Ride",
        "sample_id": "tr505-crash",
        "shape": {
          "angle_rad": 0.12,
          "center": [
            0.7357978696653814,
            0.34474149010378674
          ],
          "rx": 0.13206425754366688,
          "ry": 0.05365110462711467,
          "type": "ELLIPSE"
        },
        "trigger_type": "HAND_TIP",
        "zone_id": "crash_ride"
      }
    ],
    "zones_hash": "sha256:afa53f52b219c0710908979002949e7ca076fb137c5c7bec33fba103542243b9"
  },
  "playing_area": {
    "both_valid_fraction": 1.0,
    "distance_advice": "OK",
    "frames": 151,
    "hand_span_px": {
      "LEFT": {
        "median": 30.00000000000002,
        "n": 151
      },
      "RIGHT": {
        "median": 30.00000000000002,